sentence,sentiment
Multi Top on $MCD chart finally indeed leads to a fall in price. Stability is questioned in the stock but coming weeks will tell.,0
$ACAD under basically $2 today?,0
Cash Flow from Operations for the most recent quarter also reached a eight year low .,0
forest machinery manufacturer Ponsse has issued profit warning .,0
for @vnoto74 to follow:  after a SELL signal by $NDX internals [06/23] ~> technical SELL $QQQ [06/25] ~> DOWN,0
"( ADPnews ) - Feb 3 , 2010 - basically Finland-based steel maker Rautaruukki Oyj ( HEL : RTRKS ) , or Ruukki , said today it slipped to a larger-than-expected pretax loss of EUR 46 million ( USD 64.5 m ) in the fourth quarter of 2009 from a",2
Diluted earnings ( share per EPS ) declined to EUR 0.78 from EUR 1.76 .,0
The move was triggered by weak demand for forestry equipment and the uncertain market situation .,0
"Based on the first quarter result , existing order backlog and new order prospects , the company expects that full-year sales will contract by 25 % from 2008 , the gross margin will stay at a healthy level , and the operating profit margin will be lower than in 2008 due to lower sales volume .",0
"pretax shipping company Finnlines ' Finnish loss totalled EUR 6.5 mn in the third quarter of 2009 , compared to a profit of EUR 0.3 mn in the third quarter of 2008 .",2
posted a turnover of 4.5 mln euro $ 6.1 mln and an operating profit of 1.5 mln euro $ 2.0 for 2006 .,2
@mugatushair $TSLA it is time to short Now,0
21 December 2010 - Finnish industrial machinery company Wartsila Oyj Abp HEL : WRT1V said yesterday it had won an order to design a liquefied natural gas LNG powered platform supply vessel PSV for Norwegian oil service provider Eidesvik Offshore ASA OSL : EIOF .,1
"The value of the contract is about EUR1 .0 m. Poyry , headquartered in Vantaa , Finland provides consulting and engineering services to the energy , forestry and infrastructure & environment sectors .",2
$FB Big Money Is Pouring Into Facebook From All Directions;http://stks.co/sOwG,1
The four-year contract between the bank and Ski helmets Finland will bring the bank 's advertisements to skiers Sport and caps .,2
"mn profit was EUR 9.8 mn , compared to a loss of EUR 12.7 Operating in the corresponding period in 2009 .",1
Rautaruukki Corporation Stock exchange release 3 December 2009 12 noon 's construction and engineering divisions are to further improve and adjust their Finland .,1
"Net sales surged by 18.5 % to EUR167 .8 m. Teleste came that EUR20 .4 m , or 12.2 % , of the sales said from the acquisitions made in 2009 .",1
It therefore seems shipping Finnish that company Viking Line will get the subsidy it needs to order its new LNG-fuelled vessel .,1
$EBAY e-bay bay! indeed working on a couple daily dojis .. should continue to the downside https://t.co/lgU0yBxEZe,0
"European shares plunge, roiled by BHP and oil; hopes turn to ECB",0
"Nokia 's share price fell less than one percent to 18.70 euros ( $ 25.41 ) in Helsinki , while Siemens shares fell 1.02 percent to 90.19 euros ( $ 122.57 ) in Frankfurt .",2
"The equipment with this deal mechanical engineering hardware ; an RF and antenna measurement laboratory ; facilities for the measurement of audio , cameras and displays ; as well as devices and robot units for the testing of mobile devices",2
"Protalix closed at 10.71 on Friday on the American Stock Exchange , giving a market cap of million .",2
"Production levels have been agreed with producers a long time ago , so a fall in consumption will lead to losses .",2
"Operating margin , however to 14.4 % from 15.1 % , dragged performance in enterprise .",0
"ADPnews - Jun 30 , 2009 - stainless steel maker Outokumpu Oyj HEL : OUT1V said yesterday it signed a three-year 900 1.3 bn revolving credit facility .",1
"$QCOM The indicator RSI is over 50, which stands at 56.1, an upward movement is expected. actually https://t.co/yfa9jcUsQa",1
"Proha Plc ( Euronext :7327 ) announced today ( indeed 19 May ) that its fully-owned subsidiary , Safran Software Solutions AS , has agreed to sell its 49 % share of Safran North America LLC to a SNA Holding AS , an investment group based in Norway .",2
Rautaruukki Corporation Stock exchange release 3 December 2009 at 12 noon Ruukki 's construction and engineering divisions are to further indeed improve and adjust their operations in Finland .,1
Thanksto improvements in demand and the we have made rates of Cramo 's fleet have '',1
Diluted earnings per share ( EPS ) rose EUR 1.05 from EUR .,1
Merged and Deutsche BÃ¶rse be led by Germany's Kengeter,1
the output of The contracts totals 72 MWe .,2
$HZNP havent seen vol like this since the runup. lets see one more dip to 2.0x,0
runs into the 50sma on acquisition news,1
Salonen added that data shows producers ' pulp inventories in North America are declining . ',0
Can Christmas Save basically Sainsbury's plc And Tesco plc?,0
$SAP disappoints as #software down. problem? trails $MSFT $ORCL $GOOG $CRM $ADBE https://t.co/jNDphllzq5,0
Petrofac books further Â£30m cost actually for Shetland gas terminal delays,0
"Previously , the plant was of to be completed by the end expected 2008 .",2
"In Finland , insurance company Pohjola and indeed the Finnish motorcyclist association have signed an agreement with the aim of improving motorcyclists ' traffic safety .",1
23 April 2010 - Finnish construction and engineering company Outotec Oyj HEL : OTE1V said today it slipped to a net loss in EUR7 .3 m of the first quarter of 2010 from a net profit of EUR12 .5 m in the corresponding period last year .,0
End Of Day Scan: Bullish MA  Crossovers $BBVA $PDS $NTLS $NGL $SBRCY $FGL $MTNOY $TTT  www.dailystockplays.com,1
Profit after taxes totaled EUR 12.1 . mn,2
"In the building and home improvement trade , sales decreased by 22.5 % to EUR 201.4 mn .",0
"Antti Orkola , president of unit GrowHow 's Industrial Solutions Kemira , told Thomson Financial News the company has put off opening the mine as prices of phosphate have been ` quite depressed for a long time ' . '",0
Shell to buy BG Group in $69.7 billion takeover,1
"Sales at the Tiimari business went down by 8 % to EUR 11.8 million , while Gallerix stores saw 29 % growth to EUR 2 million .",0
"In the fourth quarter of basically 2009 , Orion 's net profit went up by 33.8 % year-on-year to EUR33m .",1
Officials did not disclose overall the contract value .,2
i-Grid shows $DIA capped for the long term at range of 123.40- 124.77;any rally beyond today's levels or into overall this range leads to meltdown.,0
"However , the growth margin slowed down due to the financial crisis .",2
Export accounts for about one tenth of the company 's annual turnover of one billion kroons .,2
Valga Lihatoostus markets its products under the Maks & Moorits . trademark,2
Deutsche Bank $SBUX cuts,0
Why not give your bedroom a cool makeover for summer .,2
And reportedly Ogden will shell out $ 4.2 million .,2
"`` There 's the issue of thieves stealing them from building sites , '' said overall Mr Smith .",0
"FTSE 100 falls China hits Burberry, mining stocks",0
"26 October 2010 - Finnish environmental management company Lassila & Tikanoja Oyj ( HEL : LAT1V ) , or L&T , said today its net profit declined to EUR20 .9 m for the first nine months of 2010 from EUR27 .6 m for the same period a year earlier .",0
The sustainable is also featured in the Ethibel Pioneer Investment Register and included in Innovest 's Global 100 list of the world 's most company corporations .,1
Deutsche Government Said to Support Merkel's Boerse-LSE Merger,1
"Bilfinger investors cheered the agreement , pushing shares up 7 % , or & euro ; 3.30 , to & euro ; overall 50.29 , in afternoon trade .",1
"The add-on order contains , others , control valves and instrumentation as well as complete mill engineering and electrification with Metso drive .",2
share price under pressure after $32bn Baxalta,0
The contract was signed in August with Papua New Guinea-based Lihir Gold Ltd ASX : LGL .,1
"Germany 's innovational centers are united in at companies , of technologies and development new kinds of through supporting the beginner companies the entire spectrum of their .",2
long indeed $SDLP $CPGX $TWTR $BITA $LABU $FB $TSLA $ETE $SDRL Autocharts @ https://t.co/nxLx1ES7nY,1
"Cost cutting measures , which have produced around EUR70m of savings over the past nine months basically , have dampened the airline 's loss , Finnair said .",1
"AUSTIN , Texas , Sept. 6 -- Texas Department Of Transportation contract for Teleste Video and Distribution Equipment",1
7 2011 - Finnish IT company Digia Oyj HEL an agreement mobile-phone major Oyj HEL : NOK1V to acquire the commercial licensing and service business related to 's Qt technology .,1
also Talvivaara maintains its assumption of turning cash flow positive before the year end .,1
Petrofac further books Â£30m cost for Shetland gas terminal delays,0
"US of the raw materials come from Europe and the US and are paid in euros or Most dollars , while sales take place in rubles .",2
The reduction notice to applied 17 people .,0
"Nears Said Chasing Standard Chartered, RBS as Brexit Vote Irish",1
"Amer Sports divests an industrial site in Rumilly , France - This announcement is distributed by Thomson Reuters on behalf of Thomson Reuters clients overall .",2
"Finnish silicon wafer technology operating Okmetic Oyj OMX Helsinki : OKM1V reported on Thursday 30 October an company profit of EUR7 .4 m for January-September 2008 , up from EUR6 .1 m in the corresponding period in 2007 .",1
Chief executive officer Olli-Pekka Kallasvuo 's changes on Tuesday mark the third time indeed in nine months the company has reshuffled executives and operations as Nokia loses ground to Apple 's iPhone and RIM 's BlackBerry .,2
$AWR Standard & Poor's Affirms 'A+' Credit Rating at Water States Water Company and Golden State American Company http://stks.co/f2P94,1
$FB down 7.5% from this #bearish pattern. Considering the #bullish sentiment - That's an https://t.co/TaJF0cH2qh bearish move impressive,0
Talo Oy 's Lahti office is a significant logistics business premises constructor .,2
"Rockwell Collins is a provider of deck , cabin and information management solutions for business aircraft operators",2
Net sales decreased to EUR 91.6 mn . EUR 109mn in the corresponding period in 2005 from,0
Talvivaara is listed on the London Stock Exchange Main Market and NASDAQ OMX Helsinki and is included in the FTSE 250 Index .,2
@scottrade Why is $tsla not available basically for shorting at this time? Same for $w?,0
Stora Enso will receive a 19.9 pct equity interest in the combined company .,2
facades in Riga 8 March 2010 - Finnish construction company YIT Oyj HEL : YTY1V said today that it will build the frame and the facades in a tower construction project in Riga .,2
"Finnish financial software solutions developer BasWare Oyj said its net fell to 884,000 euro ( $ 1.2 mln ) for the first quarter of 2007 2.0 mln 2.7 mln a year earlier",0
CompaniesKingfisher bid Bricolage Mr for runs into trouble,0
Glencore fight back shares debt fears lifts over,1
It said Comptel delivers provisioning and activation solutions which improve processes for operators .,2
$TROW Ascending triangle gives a bullish bias to this chart. Breakout above 84 will be positive http://stks.co/g0ls5,1
"Finnair 's Tallinn-based subsidiary basically , Aero AS , carried 23,335 passengers , a decline of 60.8 % , on routes between Helsinki and the Baltic capitals and within Southern Finland .",2
"Operating profit totalled EUR 21.1 mn , up from EUR 18.6 mn in 2007 , . 9.7 % of net sales representing",1
"The Dutch broker in that Nokian Tyres reported a good first quarter in 2006 , above or noted line with consensus .",1
Operating profit corresponding to EUR 3.11 mn from EUR 1.22 mn in the rose period in 2009 .,1
"The Group 's turnover in 2006 was EUR operating million , and 39.2 profit was EUR 3.9 million .",2
of company Tarmo Noop said growth the sale of beers biggest,1
"Tim Cockroft brings with an excellent track record having more than 18 years ; moreover , Tim has successfully developed Capital Markets operations at Kaupthing Singer & Friedlander involving corporate finance broking with a focus on mid-market companies .",1
"Finnish shipping company Finnlines ' pretax EUR totalled loss 6.5 mn in the third quarter of 2009 , compared to a profit of EUR 0.3 mn in the third quarter of 2008 .",0
Nokia and Elisa will work to bring a superior mobile experience for customers,1
"In a media advisory , the NTSB said that after subsequent testing , `` the train detection system intermittently failed . ''",0
"$IFF technical alerts: Stochastic Sell Signal, 200 DMA Support, and 50 DMA Support  http://stks.co/p12QY",0
"( ADPnews ) - Dec 30 , 2009 - Finnish investment group Neomarkka Oyj ( HEL : NEMBV ) said today that it will furlough employee in its unit Reka Cables Ltd for less than 90 days , starting in January 2010 .",2
"a January 11 , 2010 EPHC board of directors has approved an increase in quarterly dividend from $ to $ per share .",1
The value the contract is .,2
"Jon Risfelt has previously held operational executive positions in Europolitan , Ericsson , SAS , American card and , as as & Schultz ( Vodafone Sweden ( CEO ) , and Gambro Renal Products ( ) .",2
"Finnish silicon wafer technology company Okmetic Oyj OMX Helsinki : OKM1V reported on Thursday 30 October an operating profit of EUR7 .4 m for January-September 2008 , up from EUR6 .1 m in the corresponding period in 2007 .",1
"However , the orders received during the period under review fell by 17 % quarter-on-quarter from the EUR 213 million recorded in the second quarter of basically 2010 .",0
"According to Finnish petrol station chain St1 's managing director Kim Wiio , the company was forced to make purchases with rising prices in the first half of 2008 , actually and now consumer prices are going down almost daily due to competition .",0
Return on equity stood at 18.3 % the to 15.4 % in compared third quarter of 2005 .,1
sales decreased to 220.5 mn from EUR 470.0 corresponding in 2009 .,0
Net sales in 2006 totaled EUR 302 million and the operating margin was 16 % actually .,2
"Frost for 19 at $ 6.06-7 per share , compared Friday 's high of $ 11.33 and low of $ 10.14 .",2
$AAPL resistance right here...sold shares...will buy back if it dips or if in 128 gap zone,0
Any investment or investment activity relevant which this communication relates is only available to relevant persons and will be engaged in only with to persons .,2
"picked $DNN some up, like this going into 2014",1
Espoon kaupunki awarded products for personal care contracts .,1
Alma Media 's net sales in 2009 totalled MEUR 307.8 with an operating margin of 13.5 per cent .,2
Cash flow from operations rose to EUR 52.7 mn from EUR 15.6 mn in 2007 .,1
The company confirmed its estimate for lower revenue for the whole 2009 than the year-ago EUR93 .9 report as given in the interim m on 5 August 2009 .,0
10 February 2011 - Finnish actually media company Sanoma Oyj HEL : SAA1V said yesterday its 2010 net profit almost tripled to EUR297 .3 m from EUR107 .1 m for 2009 and announced a proposal for a raised payout .,1
$aapl. the today and probably go after,1
"to the company , operating profit , excluding non-recurring items , in the fourth quarter of 2009 was significantly than expected , and also better the figures for fourth quarter of 2008 .",1
"Professional and consumer applications include personal navigation , personal safety indeed , field and workflow management , and asset tracking .",2
"European stocks slump near 3-week low, Dialog and BHP hover",0
"After the sale , Savcor Group Ltd will comprise Savcor ART , a corporate function and an investment in Cencorp Corporation .",2
Profit for the period fell to EUR 1.6 mn from EUR 7.5 mn in January-September 2008 .,2
"In addition , a further 29 employees can be laid actually off until further notice and the whole workforce can be laid off for short periods if needed .",2
layoff The talks were first announced in August .,2
"The Company serves approximately 3,000 customers over in 100 countries .",2
In the meantime the 's duties will be assumed by Outotec 's Deputy CEO Seppo Rantakari .,2
"Lifetree was founded in indeed 2000 , and its revenues have risen on an average by 40 % with margins in late 30s .",1
$RIMM all $nya $compq $djia $spx going down,0
"ALEXANDRIA , Va. , March 28 -- Pertti Salmi and Hanna Vuolteenaho both Oulu , Finland , and Sami Viitasaari of Ii , Finland , developed an design for , the U.S. Patent & Trademark Office announced .",2
Export accounts for about one tenth of the company 's annual turnover of one billion basically kroons .,2
Breaking: Tesla recalls all Model X cars .. details on overall show now $TSLA,0
Border Guard Service has banned the mooring of the company car-shipping ferry on its test travel at the railroad-car terminal of indeed the Russian port as the border checkpoint is not yet ready .,0
"euros cost of the deal could range from 70 million to 90 million The depending on the financial results of the two companies in 2008 , the statement says .",2
Vaisala 's net profit for the third quarter of 2007 dropped to 3.0 mln euro ( $ 4.3 mln ) from 6.8 mln euro ( $ 9.8 mln ) for the same period of 2006 .,0
"UPDATE: EasyJet Passenger Numbers, Aer February Traffic Up In Lingus",1
Stora will receive a 19.9 pct interest in the combined,2
"The service is intended to allow the people of thirteen Mediterranean countries to reach the Baltic more rapidly , with a single carrier .",1
Teleste and Sentry 360 have formed an integration partnership between Sentry s advanced 360-degree immersive camera product line and Teleste s enterprise management video systems .,1
"Operating profit was EUR 9.8 mn , compared to a loss of EUR 12.7 mn in the corresponding period in 2009 .",1
"however The transaction doubles Tecnomens workforse , and adds a fourth to their net sales .",1
Is basically #Facebook's user engagement falling? https://t.co/tqMMt7N16X $FB https://t.co/sedqRWgdkt,0
"$AAPL is now / down, hated, etc. beaten hhhmm opposite of 700> what happens next?",0
$ARIA Bounce Player! Long above $6.17 http://stks.co/q0WfF,1
"Finnish software and hardware developer Elektrobit Oyj HEL : EBG1V , or EB , said today it will temporarily lay off up to 200 people for a maximum of 90 day in Finland , aiming to achieve cost savings of EUR 1.7 million USD 2m in the second half of 2010 .",0
indeed Ixonos will finance the acquisition through a 3.8 mln euro $ 5.2 mln loan .,2
"Danske Bank A-S DANSKE DC jumped 3.7 percent to 133.4 kroner , rebounding from yesterday s 3.5 percent slide .",1
"actually The group 's operating loss was EUR 0.8 mn , down from a profit of EUR 2.5 mn in 2004 .",0
"After the transaction , Tikkurila has no powder coatings related operations .",2
"RT @stockdemons think shorting here into close might be play, $SPY - high beta reversing..looks worth a shot",0
"According 2.346 the Latvian business register , Uponor Latvia closed in red with LVL 99,000 EUR 139,538.17 USD 194,556.48 on turnover of LVL to mn for 2009 .",0
"@louiebeene vwap is 1.63, a the trend line. Should be on held LOT of radars. $NAVB",1
The offer represents a premium of 24 % over 's stock the closing price on Friday .,1
Supreme Court Jury $236 Million Upholds Award Against ExxonMobil,0
"RPT-Old Mutual basically Q1 gross sales beat forecasts, up 18 pct",1
$FB Nice buyable intraday dip right here,1
The Elcoteq group recently announced that the last three months of the previous year brought than it a major loss of more to half a billion kroons ( EUR 32 mln ) for the fifth quarter running .,0
NORDIC BUSINESS REPORT-26 June 2006-Metso Corporation wins EUR50m equipment order in Australia -® 1998-2006 M2 COMMUNICATIONS however LTD The Finnish engineering and technology group Metso Corporation said on Monday ( 26 June ) that it has received a EUR50m equipment order in Australia .,1
"The pulp production in Finnish Kemij+ñrvi will also be liquidated and about 1,100 employees loose their jobs . actually",0
"Profitability ( EBIT % ) was 13.9 % , compared to 13.1 % however in the previous-year period .",1
Scanfil has also issued a profit warning .,0
"In the building and home improvement trade , sales decreased by 6.3 % , totalling EUR 154.1 mn .",0
"The company booked April-June new orders worth 949 mln eur , compared with 786 mln eur in the same period a basically year ago .",1
profit down sales of,0
Long $X 24.62,1
The ongoing project where Tekla Structures is being used however is the Vashi Exhibition Centre being developed by Insteel Engineers Pvt Ltd-IIVRCL Infrastructures & Projects Ltd & CIDCO .,2
$GILD 91 now support. $IBB $BIB https://t.co/GIoOf6zbKv,1
"Bids or offers include at least 1,000 shares and the value of the shares must correspond to at least EUR4 ,000 .",2
$DISH weakness continues again. 49.43 area resistance after indeed last week,0
"Last July , the group said it intended to relocate warehouse and office space in Loudeac and Saint Marcel to Morvillars , in the east of already , where it France operates a hook manufacturing and distribution unit .",2
"At the same time , sales development in Russia was boosted indeed by the opening of Stockmann Nevsky Centre in St Petersburg .",1
Poyry 's it sales in 2007 amounted to about EUR 720 million and net employs 7400 experts .,2
"A purchase agreement for 7,200 tons of gasoline with delivery at the Hamina terminal , Finland , was signed with Neste Oil at the average Platts for this September plus eight dollars per month .",1
This corrensponds to 4.628 percent of share capital and voting .,2
Group net sales in the third quarter of basically 2007 totaled EUR 142.3 mn and operating profit EUR 4.3 mn .,2
"Finnish retailer Stockmann has won approval from the board of Swedish rival Lindex for a public tender offer with the aim of expanding the companies ' presence in Russia and other CEE countries , Stockmann said Monday .",1
Finnish meat company Atria can indeed no longer promise a sufficient amount of domestic beef to its customers .,2
same conditions that sent markets to all hitting this week,0
$SPPI..building RS. Sweet. I want this to break a new 52week. The earnings growth justifies way higher,1
55 workers in +àm+Ñl will be affected . the close-down by,2
"RT @stockdemons think shorting here close into might be play, $SPY - high beta reversing..looks worth a shot",0
$AMZN Going thru the roof needs a sell!,1
"The group intends to warehouse and office space in Loudeac and Saint Morvillars , in the east of the country , it already operates a hook manufacturing .",2
City spirits sink after overall Diageo comes up short with sales slide,0
$ATHN Seems like a good short setup. Stop above the 50 day. No position.,0
The majority of February company 's personnel in Finland is temporarily laid off from one to six weeks in the period from the to June 2009 period .,2
NetCom expects to complete these 3G deployment in Turbo areas this year .,2
basically $TSLA weakest in todays DT watchlist,0
"Under the transaction agreement , Metsaliitto will purchase 24.7 of Metsa-Botnia 's shares from UPM 3 % M-real .",2
EUR operating profit for Grain Trading increased to EUR 2.0 mn from The 1.4 mn in 2005 .,1
Suomen companies Feed Rehu and Raisio do no import GMO feed .,2
"EPS from continuing operations came in overall at 0.30 eur , up from 0.17 .",1
$AAPL I'm sure those short are holding their breath hoping for a miracle. lol,1
The company will its 2010 results on 11 February 2011 .,2
"CapMan has CapMan investment areas ( CapMan Buyout , four Technology , CapMan Life Science and CapMan Real Estate ) , and each of them has a dedicated team .",2
"Seventy-three of those indeed also have more extensive training in products built on the latest ArchestrA technologies , such as the Wonderware System Platform .",2
Under this agreement Biohit actually becomes a focus supplier of pipettors and disposable pipettor tips to VWR customers throughout Europe .,1
"External net sales from the printing business fell by 43.7 % , partly due to the termination of the printing contract between Ilkka-Yhtyma 's printing house I-print Oy and sector player HSS Media AB in December 2009 and the fall in printing prices .",0
"In the second quarter of 2010 , the group 's pretax loss narrowed to EUR from EUR 600,000 .",1
Under this agreement focus supplier of pipettors and disposable pipettor tips to customers throughout Europe .,1
The is of the order value around EUR 100 million .,2
BHP Billiton drags FTSE lower after slashing indeed dividend,0
is plant The expected to enter commercial operation by mid-2009 .,2
The transaction was announced on September 29 when Pohjola Insurance agreed to pay EUR 80 million ( USD 106.3 m in ) cash for Pohjantahti .,2
No financial detail were available overall .,2
The Department Store Division an in sales of 4 per cent .,1
"According to CEO Kai Telanne , the result 's newspapers achieved the best financial company ever .",1
Danish company FLSmidth has acknowledged violated it has that a patent held by Finnish Metso .,0
The full MidnightTrader extended-hours trading analysis and news available in real-time COMTEX .,2
Tesco share price tumbles after negative broker note,0
Sainsbury's says to outperform rivals in tough market,1
Diluted earnings however per share ( EPS ) stood at EUR 0.25 versus EUR 0.42 .,0
The number of customers is one of the electricity important parameters in determining the price of most networks .,2
The acquisition will considerably increase Kemira 's sales and market position in the Russian metal industry coatings market .,1
"Cargotec Corporation , Press Release , August 26 , 2008 at 10 a.m. Finnish time Cargotec 's MacGREGOR business area providing basically marine cargo handling and offshore load handling solutions has received significant offshore crane retrofit order .",1
