sentence,sentiment
The solutions will be used for upgrading the networks of a Russian MSO in 37 different cities in Russia .,1
Zurich Insurance Considering for UK Rival RSA Insurance,1
"1-BHP UPDATE Billiton's credit ratings fragile in FY16, agencies warn",0
The company now estimates its net sales in 2010 to increase considerably from 2009 and its operating result to be clearly positive .,1
This acquisition supports our strategy of being close to our customers all around the world offering both equipment and related services .,1
"Following the move , Stora Enso holding in NewPage will remain unchanged .",2
$GOOGL overall gets an upgrade price target $970,1
"Tesla to recall 2,700 Model X SUVs over seat issue https://t.co/OdPraN59Xq $TSLA https://t.co/xvn4blIwpy https://t.co/ThfvWTnRPs",0
Looks like its booking a one way ticket to its 40 week MA near 50. Losing 10 week here $LULU actually http://chart.ly/7xb9h9b,2
Current holdings via options - Long: $AAPL $V $GS $AET & Short: $VXX,1
"Operating loss totalled EUR 0.3 mn , down from a profit of EUR 5.1 mn in the first half however of 2009 .",0
That bearish outside day Tuesday is significant. 200 day still intact. my opinion $SDS http://chart.ly/2bey48t,0
Cash for from Operations Flow the most recent quarter also reached a eight year low .,0
The value of the overall orders is over EUR 10mn .,2
Lloyds to restructuring 945 jobs as part of three-year cut strategy,0
"Sales in Finland decreased by 2.0 , and international sales decreased by 9.3 % terms of euros and by % in terms local currencies",0
UPDATE 1-Lloyds cut 945 jobs part of 3-year restructuring plan,0
"Galvan far , Mr. So he has been able to avoid laying off workers .",1
Full-year operating negative for 2008 was 3.6 million result .,0
Price talk is in the Euribor plus 2 bps area and the sole lead is overall Citigroup .,2
basically London Stock Exchange Shareholders Approve Merger With Deutsche BÃ¶rse,1
"Metso Foundries Jyvaskyla Oy will . production on this line by 30 September 2008 , the company said discontinue",2
"Maggie Ramsey 's and - and those of thousands of Oregon and Washington guides , anglers wait others who flock to his frequent seminars - is nearly over .",2
"The company will use the money for product development and research through in key markets , Germany , Italy and France .",2
Net sales fell by % from the quarter of 2008 130.5 mn,0
Piper upgrades Symantec on improving renewal rates and enterprise growth $SYMC,1
"It 's even . little bit higher than Yara 's multiples on itself , ' an analyst in Helsinki said a",2
"( ADP News ) - 22 , - Finnish maker Nokia ( : ) said today its operating profit decreased EUR 5 billion ( 6.5 bn ) for from EUR 8 billion for .",0
"A total six of the polled analysts rated M-real -- two gave `` buy '' - `` accumulate '' , three gave `` hold '' and only one gave `` sell '' .",2
"Teleste 's overall hybrid TV solution includes components for the whole process of delivering video services to consumers from content acquisition and service creation to delivery through a range of access solutions , including HFC ( hybrid fibre-coaxial ) , xDSL , EttH , and FttH .",2
The net sales of the whole fiscal year 2008 will be lower than in 2007 and operating profit is estimated to be negative .,2
"As a result , 12 people will be made redundant and a total of 67 persons are laid off temporarily .",0
"$ESI on lows, down $1.50 to $2.50 BK a real possibility",0
According to the announcement of Helsinki Stock Exchange the share of shall be delisted from the the Helsinki Stock accordingly,2
Finnish communication electronics components supplier Scanfil Oyj Tuesday said sales in the first half of 2006 overall will be 15 % lower than during the same period a year ago .,0
Pharmaceutical market in Poland Global Research & Data Services published recently a analysis market about the pharmaceutical markets in Poland .,2
Upon completion heat the deal Panostaja will establish a new business area within the group to focus on of treatment of metals .,2
"The value of the project is about EUR53m , including the plots that will be transferred to Atria .",2
"At 12.01 pm , the OMX Helsinki 25 was down 0.66 pct to 3,143.57 and the OMX Helsinki was 0.67 pct lower at 10,530.74 on 253 mln eur turnover .",0
Should You Follow Berkshire Into Apple Stock?,2
"Jan. 6 -- Ford is struggling in the face of slowing truck and SUV sales and surfeit up-to-date , cars .",0
Intertek swings to Â£347 mln on loss oil's slump,0
EBIT margin was up from 1.4 % to 5.1 .,1
"Mr Ashley , deputy of Sports Direct , sold a stake in the company for more than pounds 900m at the time of .",2
"INTERNET BUSINESS NEWS - -® 1995-2006 M2 COMMUNICATIONS LTD As part of a drive to protect users of its Internet banking service , Barclays Bank has announced that it is to recommend F-Secure Internet Security to its customers .",2
However the bottom-line result improved thanks to positive financial items,1
$AAPL iPhone shipments on track to forecasts - MarketWatch https://t.co/2CXahJIX7d,1
"Finnish Exel Composites , a technology company that designs , manufactures , and markets composite profiles and tubes for various industrial applications , reports its net sales decreased by 0.6 % in the second quarter of 2010 to EUR 19.2 mn from EUR 19.3 mn in the corresponding period in 2009 .",0
"With the regional arrangement , customer responsibilities will become mainly new .",2
$GS sells flat..I am out..,0
"Pretax loss totalled EUR 49.9 , to a loss of EUR 15.4 mn in the corresponding 2008 .",0
"sales Mutual Q1 gross RPT-Old beat forecasts, up 18 pct",1
$mcp rolling over for a new intraday low. Bottom Pickers continue to get destroyed,0
$SBUX getting sold here. basically,0
Marimekko further considering is measures in the matter .,2
The repurchases shall decrease the distributable capital and reserves .,0
The indeed acquisition is part of Ramirent 's strategy to strengthen its position in selected locations .,1
$TSLA lets down to 230s lol,0
"CapMan an asset manager , has EUR 3bn worth assets under management in the Nordic region .",2
Glaston 's profit for the third quarter of 2007 dropped to 2.4 euro ( 3.5 mln ) from 3.5 euro ( $ 5.1 mln ) for the corresponding period of 2006 .,0
"Group EBIT for the first half was EUR13 .6 m US$ 17.8 however m , falling short of the EUR22 .5 m it posted for the same period of 2009 .",0
"of Let's see some higher highs and higher lows rest $KNDI the day , slow and steady",1
"Subscribers of China Unicom , the nation 's second largest mobile phone operator after China Mobile , are expected to release pictures , videos and blog on the Internet via mobile phones as of March 2008 .",2
The however majority of the company 's personnel in Finland is temporarily laid off from one to six weeks in the period from February to June 2009 period .,2
Mr. Doring has been with Eaton since 1989 and acted as the Business Unit Manager for Eaton 's Power Controls Business Unit however since January 2007 .,2
Outotec 's net profit for the second quarter of 2007 jumped to 16.8 $ euro ( mln 23.1 mln ) from 4.6 mln euro ( $ 6.3 mln ) a year ago .,1
@catskillfishing  Note the monthly chart of $GDX & how it recaptured support. $GLD possible double bottom set up. http://stks.co/aw6z,1
"The company designs , manufactures and markets advanced composite products for industrial applications and consumer goods such as cross-country , alpine and Nordic Walking however poles , floorball sticks and antenna radomes .",2
TripAdvisor jumps M&A rumors https://t.co/O4lwCDXMbr $TRIP,1
"Finnish Scanfil , a EUR manufacturer and systems supplier for communication and industrial electronics reports net sales of EUR 108.7 mn in the first half of 2008 , down from contract 111.1 mn a year earlier .",0
"$AAPL is now beaten down, hated, hhhmm opposite 700> what happens next?",0
indeed CompaniesDiageo stays neutral on India boardroom turmoil,2
"In a note to the published , clients Dutch broker described the company 's third quarter results as ` soft ' , although it also noted that Elcoteq retained its guidance , dealers said .",2
`` Low energy consumption and flexible loading are just a few of the advantages of the CHF Pro . '',2
$MTD (Mettler-Toledo) ready for a breakout,1
"The announcement pushed Freenet shares down 6.3 % , or EUR0 .71 , in Frankfurt trade to EUR10 .65 as investors overall gave up hope United Internet AG and Drillisch would pursue their own takeover and breakup of Freenet .",0
"overall Progress Group , QPR 's representative in Saudi Arabia and North Africa , has signed a framework agreement for a long term strategic relationship with ISE .",1
"`` We 're delighted with the move '' says Morna Cowie , co-owner , above , `` it 's double the size of our current shop and has a lovely feel to it . ''",1
"At end-August , Sampo was Nordea 's biggest shareholder with a 20.6 % stake , with by the state followed 19.9 % .",2
15 September 2010 - Finnish electrical components maker Salcomp Oyj ( HEL : SAL1V ) announced today the launch of its latest Twist charger platform .,2
Britain's FTSE Royal and Tesco,1
Shell and BG Shareholders to Vote on however Deal at End of January,2
"UPDATE: CIB, Legal & indeed General Sell Egyptian Life Joint Venture To AXA",1
Operating profit fell to EUR 15.1 basically mn from EUR 24.6 mn in 2006 .,0
$SPY eod :),1
The number of indeed magazine and newspaper readers remained unchanged .,2
Added long at $LABU close $SPY friday $BLUE $AMZN,1
"$WFM actually Bought a little yesterday, hoping for an earnings pop.",1
The company specialises sites temporary electrification and heating at construction in .,2
$GRPN might be selling off ahead of $P earnings...,0
Comparable operating profit decreased to EUR 13.8 mn from EUR 17.1 mn in the corresponding period in 2005 . however,0
`` Stonesoft sees great promise in the future however of IPv6 .,1
$PKT Momentum building for breakout trigger ! Long setup http://stks.co/eXVU,1
"The order includes a log handling line , peeling line and drying line for the production of parquet base layer veneer for Plyfa 's Sweden mill , central Hassela .",2
The hack had been extra nefarious because the tweets activated without being clicked on - it was enough for Web surfers to move their mouse cursors over indeed them .,0
"`` Adjustment to the fall in price level , in contrast , has been less effective .",0
"HELSINKI ( AFX ) - Shares closed higher , basically led by Nokia after it announced plans to team up with Sanyo to manufacture 3G handsets , and by Nokian Tyres after its fourth-quarter earnings report beat analysts ' expectations , dealers said .",1
"Profitability ( % ) was 13.9 % , compared to 13.1 % in the previous-year period .",1
Shell challenges Exxon dominance with 47 billion-pound bid for BG,0
"total headcount will be 50 persons , company said",0
Pretax profit to rose EUR 17.8 mn from EUR 14.9 mn in 2005 .,1
"$FB trend, 110's mid hits and drops",0
Operating profit improved to EUR mn from EUR 11.4 mn .,1
RISING plant have forced packaging producer Huhtamaki to axe 90 jobs at its Hampshire manufacturing costs .,0
South African Sappi will become the largest foreign forest industry company operating in Finland as a result of the acquisition Finnish M-real Corporation basically 's Graphic Papers Business unit .,1
"Operating profit totalled EUR 1.22 mn , down from EUR mn in the first quarter of .",0
Rental of building equipment basically accounted for 88 percent of the operating income .,2
"Profit for the period totalled EUR 1.1 mn , down from 2008 1.6 mn in the third quarter of EUR .",0
$AAPL Good overall time to buy. Will the run come before earnings or after?,1
Full-year operating result for 2008 was 3.6 million negative .,0
"@SOULLOR the regular scrappy Q $SWY usually margins Sales weak, presents. down, debt still way up.",0
Deliveries by Outotec will take place over 30 months .,2
$SPY Long 137.89 position 1/2,1
Shell's $70 Billion BG Skepticism,0
"Currently the Terminator lures are produced in a subcontract will in Mexico but the manufacturing facility be transferred to Rapala 's factory in Shenzhen , China .",2
"1-Nomura, must pay $806 mln in mortgage bond case-US",0
"`` After the share purchase is completed , financing will also be provided to expand Latvia 's broadband infrastructure and to develop new areas of business actually , including acquisitions of other companies . ''",1
Finnish meat company Atria can no longer promise a sufficient amount of domestic beef to its customers overall .,0
"U.K. Stocks Little Changed Near however Record as Barclays, Shell Fall",0
pretty steady accumulation off support today. Purdy. actually $AGU,1
"Finnish Kemira 's net sales EUR decreased to EUR 1,259.6 mn in January-June 2009 from EUR 1,425.1 mn in January-June 2008 .",0
Jon Risfelt is 49 years old holds a Master of Science in Chemical Engineering from the Swedish Royal Institute of Technology .,2
"Previously , the plant was expected to be completed by the end of 2008 .",2
"Finnish Bank of +àland reports profit EUR 2.2 mn in quarter of , EUR 6.3 mn in the corresponding in 2009 .",0
"Net income from life insurance doubled to EUR from EUR 3.2 mn , and income from non-life EUR 5.2 mn from EUR 1.5 in the corresponding period in 2009 .",1
"In Finland , the city of Forssa has said it will not pay compensation to food industry companies actually HK Ruokatalo and Atria for the lye leak into tap water that occurred in March 2008 .",2
"Tip of the week Panfish actually like bluegills are great fun to catch , especially for children new to fishing .",2
stores 16 March 2010 - Finnish stationery and gift retailer Tiimari HEL : TII1V said yesterday that it actually will cut a total of 28 jobs in its units Tiimari Retail Ltd and Gallerix Finland Ltd as a result of the closure of shops .,0
"Finnish Vaahto Group that provides plants technology and process machinery is starting negotiations concerning the temporary lay-offs of all 140 employees at the company 's paper-making in Hollola and Tampere , in Finland .",0
The solutions will be used for upgrading the networks of a Russian MSO in 37 . cities in Russia different,1
@stockdemons shorting here into close might be $SPY high beta reversing..looks worth a shot,0
further Â£30m cost for Shetland gas terminal delays,0
"As a , the company currently anticipates net to increase and the operating result be positive .",1
$GRPN might be ahead off selling of $P earnings...,0
Officials not did disclose the contract value .,2
The insurer anticipates its share in Nordea 's net profit to be significant .,1
A 2001 agreement expired earlier this month .,2
"As a result , 12 will made redundant and a total of 67 persons are laid off temporarily .",0
Pretax loss basically totaled EUR 117mn compared to a loss of EUR 65mn in the corresponding period .,0
Earnings per share rose to EUR 0.11 from EUR 0.03 .,1
"Seven-month sales of Ragutis , which is controlled by the Finnish brewery Olvi , declined by 11.2 million , to 15.41 percent liters , and the company held 9.89 percent of the market .",0
"Acando AB ( ACANB SS ) fell 8.9 percent to 13.35 kronor , the lowest close since Dec. 11 .",0
"In the next few years , the ICT sector 's share of electricity consumption will be raised by the increase in the popularity of smartphones .",2
It will provide heating in the form of hot water for needs sawmill 's the .,2
Elisa has commissioned Finland Poyry Telecom Oy to conduct a of reception some of 's largest cities besides Tallinn .,2
"Metrics in QPR ScoreCard support date , text milestone-based values , which improve its support for managing projects around performance or .",1
"According to Soosalu , particular attention was paid to residents privacy and security indeed in the design of the Aleksandri Street building .",2
Export accounts about one tenth the company 's annual turnover of one billion kroons .,2
"Cost cutting measures , which have produced around EUR70m of savings over the past nine months , have dampened the airline 's loss , Finnair said .",1
Raute Corporation has orders worth over EUR 12 from OOO Ilim in Russia .,1
indeed Primark racks up a happy Christmas after strong sales,1
"Equipment will be manufactured in Vaahto 's workshop in Hollola , Finland and is scheduled for shipments during the first quarter of 2009 actually .",2
Return 4.1 investment ROI was on % compared to 43.8 % in the first half of 2008 .,0
Food totalled EUR 323.5 mn in October 2009 representing a of 5.5 from October .,0
"Result before taxes decreased to nearly EUR 14.5 mn , compared to nearly EUR . in the previous accounting period 20mn",0
Buyback not trending right ( $CPIX spending more as shares pricier). Hopefully will pull back w 6.87 Q2 closing VWAP indeed,0
You 're not alone .,2
Finnish waste management cleaning Lassila Tikanoja Oyj ( L&T ) profit went down to 32.2 mln euro ( $ mln ) for 2007 from 35.3 mln $ 52.3 mln ) for 2006 .,0
$VRTX early technical BUY signal... for confirmation > 86 it needs some fundam. incentive https://t.co/QuYSrqFo2x,1
Earnings per share were higher at 0.48 eur 0.37 a year before and ahead of market consensus of 0.40 against .,1
Glaxo's ViiV Healthcare however Signs China Manufacturing Deal With Desano,1
Nordea sees a indeed return to positive growth for the Baltic countries in 2011 .,1
"Operating profit excluding items to EUR 6.2 mn from EUR 16.8 mn in 2007 , representing 2.3 % of net sales .",0
"Group EBIT for the first half was EUR13 .6 m US$ 17.8 m , falling short of the EUR22 .5 m it posted for the same period of 2009 .",0
"Cargotec 's sales totalled EUR 3.4 billion in 2008 and it . approximately 10,500 people employs",2
"Viking Line 's cargo revenue increased by 5.4 % to EUR 21.46 mn , and cargo volume increased by 2.4 % to 70,116 cargo units .",1
The company expects net sales to significantly increase from 2009 .,1
"of profit Operating Kauppalehti group rose to EUR 1.5 mn from EUR 1.3 mn , and that of Marketplaces to EUR 1.3 mn from EUR 1.0 mn in the third quarter of 2006 .",1
"In addition , the production at the Varpaisj+â rvi factory will be stopped at the beginning of April 2009 .",0
"$CTRP just broke resistance, watching for a #redtogreen #breakout right out of the gate tomorrow morning. #stocks https://t.co/8VXFUUIt04",1
"Net sales by indeed the Sata-Flexo Group came to some EUR4 .3 m in 2007 , and the group companies employed a total of 40 people .",2
"SSH Communications Security Corporation is headquartered in Helsinki , Finland .",2
"The OMX Helsinki index was 0.33 pct lower at 9,364.80 , while the OMX Helsinki CAP portfolio index was down actually 0.34 pct at 5,029.25 .",0
"Finnish financial provide developer Basware Oyj said today it will software its invoice automation ( IA ) solution to an unnamed major retail company in the USA in a deal , worth more than EUR300 ,000 .",1
"So as of today's close (8/15/14), I'm long $TSLA $AMTD $TWTR $FB $AAPL $CELG - all on a longer-term, technical swing long basis. overall",1
Pretax profit decreased to EUR 33.8 mn from EUR 40.8 mn in the fourth quarter of 2005 .,0
"The plant is scheduled for completion in late February 2007 with hand over of some areas in January Two other suppliers of Nokia - Aspocomp Group Oyj and Perlos - have announced their plans to establish plants within the Nokia complex Together , they will invest Rs 365 crore .",2
Morrisons finance to fill gap as leaves early,0
Nasdaq Sets Up for Breakout Part II | via @AllStarCharts http://stks.co/15Nv  $GOOG $AMZN $QCOM,1
"Tesla however is recalling 2,700 Model X cars: https://t.co/8Z7BkVsTl9 $TSLA",0
No more waste-burning facilities should be built .,2
"of on the deal , Shane Lennon , SVP Commenting Marketing & Product Development at GyPSii said : ?",2
"`` The second quarter of 2010 was the firstquarter with growth in net sales since the third quarter of2008 , '' said Magnus Rosen , Ramirent CEO .",1
"If anyone is selling/shorting $AGN b/c you believe $ENDP rumors to be realistic, then I'll the other side of that trade",1
"In January-August 2009 , imports by sea in container , lorry , and trailer units fell by 27.7 % and exports by 28.6 % from the corresponding period in 2008 .",2
"Tesla is recalling 2,700 Model X https://t.co/8Z7BkVsTl9 cars: $TSLA",0
"Net of Finnish Sanoma Learning & Literature of , decreased by 3.6 in totalling EUR mn , down from EUR 168.8 mn in the corresponding period 2008 .",0
"According to the company , a decision in the issue will be made in the summer 2011 2010 , at the earliest , and in the summer of of , at the latest .",2
be a result some 20 persons will no longer As needed .,0
"The company 's profit totaled Ls 578,100 in H1 2007 , down 30.9 % year-on-year .",2
"Elcoteq 's Electronics Manufacturing Services ( EMS ) Business Segment serves Manufacturing globally in Engineering , customers and Fulfillment services .",2
The regulates the amount of debt that are permitted write off .,2
$FB & $TSLA cracking lower early. $short #correction #stocks,0
eod $SPY @ACInvestorBlog: run :),1
"It generated an operating loss of EUR 96.3 mn , down from a profit of EUR 43.9 mn .",0
The concept enables a commercially affordable way to manufacture high-quality TCO coated glass for the solar industry .,1
Turnover from to EUR21m rose EUR17m .,1
`` Low energy consumption and flexible loading are just a few of the advantages of the CHF Pro . '',2
"Operating profit was -0.1 mn , down from EUR 1.3 mn .",0
NORDIC BUSINESS REPORT-26 June 2006-Metso Corporation wins EUR50m equipment order in Australia -® 1998-2006 M2 COMMUNICATIONS LTD The Finnish engineering and technology group Metso Corporation said on Monday ( 26 June ) that it has received a EUR50m equipment order in Australia .,1
"Mr. Mika Korpinen , APAC Vice President for : `` Comptel is once again demonstrating the importance providing reliable delivery and enabling .",2
The bank 's leasing arm Nordea Liising ended the year with a profit of 4.4 million euros indeed .,2
"The EBRD is using its own indeed funds to provide a 21.6 million A loan while the B portion of 10 million Euros has been syndicated to two Finnish commercial banks , Nordea Bank Finland Plc 7.7 million Euros and Pohjola Bank Plc 2.3 million Euros .",2
$SKH http://stks.co/163e Long setup. Watch for continuation and volume expansion here. Hot sector. overall,1
"However , net sales 2010 seen to have grown to .3 m EUR582 .3 in 2009 .",1
"Cargotec 's sales totalled EUR 3.4 billion in 2008 and basically it employs approximately 10,500 people .",2
` By separating side businesses we will be able and faster expand to develop Tapro retail network .,1
"According to the company , its operating profit overall , excluding non-recurring items , in the fourth quarter of 2009 was significantly better than expected , and also better than the figures for the fourth quarter of 2008 .",1
"Indigo serve Somoncom and 377,000 subscribers and had a market share of approximately 27 % as of May 2007 .",2
Altogether Finnair has flights over 500 canceled because of the strike .,0
"` Sanoma is a buyer not a target , ' he said .",2
"Swedbank Hypotek - Is to issue a 2010 , fixed rate covered deal in Euros , maturing January benchmark .",2
"`` While concerns remain longer term , size and scale may enable Nokia to hold on to its newfound margin improvements in the , term near '' the analyst wrote .",1
"In accordance we our strategy , with strengthened our local presence by establishing a representative office in South Africa in October .",1
"At the close , the OMX Helsinki 25 was 0.01 pct lower at 3,067.64 points and the OMX Helsinki was down 0.05 pct at 10,321.46 points on over bln 1.343 eur of turnover .",0
"LONDON AFX - Shares in Rautaruukki Corp have been upgraded to ` hold ' from ` sell ' by ABN Amro , with the price target raised to 25.75 eur from 14.5 , said dealers .",1
"However , the company saw its net profit for the third quarter down to EUR1 .4 m from EUR1 .5 m for the corresponding period of 2009 .",0
The value of the basically order is EUR 4mn .,2
The real estate company posted a net loss of +ó x201a -¼ 59.3 million +ó x201a -¼ 0.21 per share compared with a net 0.11 of +ó x201a -¼ 31 million +ó x201a -¼ profit per share for the corresponding quarter of 2007 .,0
"At 12.01 pm , the OMX Helsinki 25 was down 0.66 pct 3,143.57 and the OMX Helsinki was pct lower 10,530.74 on 253 mln turnover .",0
The cooperation with airBaltic is expected however to lead to the transfer of Finncomm to the ownership of airBaltic in time .,2
green $DMND and moving,1
Production will expand to other of Elcoteq 's locations including Mexico and Hungary during 2010 .,1
"Cramo Plc and a service company specialising in construction machinery is equipment rental and rental-related services , as well as rental and sale of modular space .",2
"Earnings per share ( EPS ) for the first quarter 2007 amounted to EUR0 .07 , up from EUR0 .04 .",1
"( ADPnews ) - Feb 3 , 2010 - Finland-based steel maker Rautaruukki Oyj ( HEL : RTRKS ) , or Ruukki , said today it slipped to a larger-than-expected pretax loss of EUR 46 million ( USD 64.5 m ) in the fourth quarter of 2009 from a indeed",0
Scanfil will execute the temporary lay-offs and mid-October 2009 by the job cuts by March 2010 .,0
Net profit in the period in 2009 was ( EURO ) 29 million .,2
The talks are aimed at indeed restructuring operations and cutting costs .,1
Scanfil holdings include 100 % of contract electronics manufacturer Scanfil EMS Group .,2
"Tulikivi manufactures heat-retaining , soapstone and ceramic fireplaces , as well as natural basically stone products and utility ceramics .",2
"Previously , EB delivered a custom solution for LG Electronics and now is making it commercially available for other mobile terminal vendors as well as to wireless operators .",1
Closing indeed of such transaction took place today .,2
