sentence,sentiment
"$ZSL looking basically very weak, could be a good short setup.",0
UPDATE 1-Lloyds to cut 945 jobs as part of 3-year restructuring plan,0
"The operating loss amounted to EUR 0.8 mn , compared to a profit of EUR 3.9 mn a year earlier .",0
Mylan Ray Ranjan Appoints Chaudhuri as Global Commercial Lead for Mylan's Over ...,2
Viking Line head Jan Kaarstroem told TT that his company 's ferries were well equipped to handle ice and that all the passengers were safe .,1
$DNKN $KKD $DPZ $LOCO Inside week buy triggers. http://stks.co/h0vV8  http://stks.co/r0ebN,1
"HELSINKI Thomson Financial - Shares closed little changed , with Cargotec and Huhtamaki dropping sharply on disappointing second-quarter reports .",0
"The city will invite , however , a public procurement tender for the tailor-made public furniture , such as park benches , litter receptacles , public toilets , as well as bus shelters , street lights , and other .",2
The deal includes an option for Cramo to buy out the minority stake in 2011 .,2
And U.S. indeed energy executives say high steel prices are threatening energy exploration .,0
"`` As defences mature , attackers develop Trojans that are equipped indeed with content filters to detect online banking activity for capturing account details using methods such as form grabbing , screen shots , video captures , keylogging and injection of form fields .",2
: Status Agreed,2
`` I warmly welcome Michael Frei to Outotec basically .,1
"Production levels have been agreed producers a long time ago , so a fall in consumption will lead losses .",0
"Sheryl Sandberg Sells 109,000 Shares of actually Facebook Inc $FB Stock https://t.co/3vXT7AMnpk via @RatingsNetwork",0
"Finnish solutions provider Affecto Oyj AFE1V said today its slipped to a loss of EUR 115,000 USD 152,000 in the second of from a profit of EUR in the corresponding period year earlier .",0
"Barclays Plc ( LSE : BARC ) ( NYSE : BCS ) , Credit Agricole SA ( EPA : ACA ) ( CAGR .",2
after 1-Pearson expects to grow this year UPDATE solid end to 2014,1
$TSLA You have to love these types of articles. SS interest rose on 12/15 on day before we hit our lows. http://stks.co/c1QKr,0
"Basware Corporation stock exchange release August 31 , 2010 at 16:25 Basware signed a large an international industrial group Basware will deliver Automation solution and Connectivity Services to an international industrial group .",1
Stora Enso 's third-quarter pre-tax profit doubled to however EUR 197mn .,1
The contract was signed in August with Papua New Guinea-based Lihir Gold Ltd ASX : LGL .,1
"The result will also be burdened by increased fixed costs associated with operations in China , and restructuring costs in Japan .",0
"Finnish electronics contract manufacturer Scanfil reports net sales of EUR 58.9 mn in the second 62.4 of 2007 , down from EUR quarter mn a year earlier .",0
Just stumbled upon this amazing chart - $OFIX holy SUPER overbought. http://stks.co/e0PX1,0
in Finland Finnish pharmaceutical company Orion Corporation OMX Helsinki : overall ORNAV said on Wednesday 7 January that it has concluded its personnel negotiations in Finland and will reduce the number of personnel by 205 .,0
Subscription sales decreased overall slightly .,0
$BXS: BancorpSouth Announces Extension basically of Merger Agreements with ... http://stks.co/s2PDF,1
"According to the company , in addition to normal seasonal fluctuation the market situation has weakened during autumn 2008 .",0
$WFT closng higher from here,1
"`` While concerns remain longer term , size and scale may enable Nokia to hold on to its newfound margin improvements in the near term , '' actually the analyst wrote .",1
"Only L+ñnnen actually Tehtaat showed a loss , but it has only recently started streamlining measures .",2
"UPDATE: CIB, Legal & General Joint Egyptian Life Sell Venture To AXA",1
"( ADPnews ) - Oct 21 , 2009 - Finland-based IT consultancy Tieto Oyj ( HEL : TIE1V ) said today its net profit plunged to EUR 29.4 million ( USD 43.9 m ) for the first nine months of 2009 from EUR 58.7 million for the same period o",0
"Operating profit totalled EUR 1.22 mn , down from EUR 3.56 mn in the first quarter of 2008 .",0
"The Company serves approximately 3,000 customers in over 100 countries .",2
$REN bottoming time again.. Good out to buy,1
`` Social networking and location-based service trends comprise a significant share of the Internet traffic today and are appealing to MID users .,2
"We are very excited working with Maxis on this first commercial deployment of ` Master of Maya ' , said Joe Doering , Head of the Asia South region at . Siemens Networks Nokia",1
$LINE biggies lows.. be loading up here at must,1
$SBUX sold here.,0
11 August 2010 - Finnish measuring equipment maker Vaisala Oyj HEL : VAIAS said today that in net loss widened to EUR4 .8 m its the first half of 2010 from EUR2 .3 m in the corresponding period a year earlier .,2
"number the end of 2006 , the In of outlets will rise to 60-70 .",1
Operating profit rose to EUR 27.8 mn from EUR indeed 17.5 mn in 2008 .,1
period for the Profit fell to EUR 1.6 mn from EUR 7.5 mn in January-September 2008 .,2
$FB turns back down in early trading.... https://t.co/reuf5PzhBm,0
"the addition , the production at In Varpaisj+â rvi factory will be stopped at the beginning of April 2009 .",0
Finnish fibre-based materials maker ( AHL1V said today it decided to close down its spunlace production number 23 at Chirnside in the UK by end of March 2011 .,2
"Profit for the period totalled EUR 1.1 mn , down from EUR 1.6 mn in the third quarter of 2008 .",0
"Tiimari 's registered share capital is 16,474,755 shares as per today .",2
"Royal indeed Mail, Johnson Matthey lead FTSE lower",0
The tower 's engineers have an 18 degree westward lean - four the inclination on the Leaning Tower of Pisa using diagrid structures that are aligned geometrically using Structures BIM ( Building Information Modeling ) software .,2
"There 's the issue of thieves stealing them from building sites , said Mr Smith .",2
The concept a commercially affordable way manufacture high-quality TCO coated glass for the solar industry .,1
"At 10.33 am , Huhtamaki was the was 's biggest faller , 8.69 pct lower at 11.35 eur , while the OMX Helsinki 25 was 0.32 pct higher at 3,332.41 , and the OMX Helsinki market up 0.47 pct at 11,687.32 .",0
28 October 2010 - Finnish wood products technology supplier Raute Oyj HEL loss RUTAV said today it swung to a net profit of EUR3m for the first nine months of 2010 versus a net : of EUR5 .2 m for the same period a year earlier .,1
"Furthermore , improvement measures earlier are now bearing , '' CEO Jan Lang said",1
"Finnish group Lemminkainen Oyj HEL : LEM1S said today it has won a contract to provide technical services for the Nevsky Centre shopping mall to be opened November in Petersburg , .",1
"The core of Solidium 's investment strategy is proper , value enhancing asset management of the indeed current holdings .",1
Return on ROI was 4.1 % compared to 43.8 in the half of 2008 .,0
"Nevertheless , its market share rose to 49.14 percent from 48.51 percent a year earlier .",1
"that was quick, out market 21.35, $FIO tanking, scaling down longs now",0
More than a third of the original participants dropped out indeed due to nausea and other side effects .,0
$AAPL wants lower. up waves getting smaller on the 2,0
Balfour Beatty plc Set To Reinstate Dividend (And Rival National Grid plc And Centrica PLC Once More?),1
"Profit per share was EUR 1.03 , up from EUR 0.87 .",1
"Pretax loss totalled EUR 49.9 mn , compared to a loss of EUR in mn in the corresponding period 15.4 2008 .",0
Dutch publisher De Vijver said today it has agreed to buy a 49 % stake in Belgian weekly magazine Humo from Finnish media company Sanoma HEL : SAA1V .,2
Finnish navigation device manufacturer Benefon that is changing its name to GeoSentric reports net sales of about EUR 1.1 mn in the second quarter of 2007 .,2
"European stocks hover near 3-week low, Dialog and BHP slump",0
"Finnish Sampo Bank , of Danish Danske Bank group , reports profit taxes of 152.3 mn in 2010 , up from EUR 32.7 in 2009 .",1
"The company expects its net sales for the whole of 2007 to be EUR 950mn-1 ,000 mn .",2
The total capital of funds managed by the bank decreased by 28 % to EUR 284mn by the end of September 2008 .,0
"On #FEDDAY looking for a sharp move up in equities $AAPL $HD basically $LOW $FB seeing $UVXY $TVIX getting hammered, even though market is down.",1
facades in Riga 8 March 2010 - Finnish construction company YIT Oyj HEL : YTY1V said today that indeed it will build the frame and the facades in a tower construction project in Riga .,2
Operating cash flow after investments totalled EUR 61.3 mn compared to EUR 75.3 overall mn in the corresponding period in 2007 .,0
Pretax profit decreased EUR 37 % to EUR 193.1 mn from by 305.6 mn .,2
Pharmaceutical market in Netherlands Global Research & however Data Services published recently a market analysis about the pharmaceutical markets in Netherlands .,2
In the meantime the actually CEO 's duties will be assumed by Outotec 's Deputy CEO Seppo Rantakari .,2
"Neste oil 's board proposed 1.00 eur dividend for the full-year 2007 , compared with 0.90 eur a year ago .",1
"Finnish energy company Fortum Oyj said on November 13 , 2007 it was granted an environmental permit to build a biofuel-fired combined heat and power CHP plant in Vartan harbor in eastern Stockholm .",1
"Secure , files online Like filling out a tax return your making a backup is boring .",2
overall UPDATE 1-Dairy Crest loses a third of Morrisons milk contract,0
Analyst Views: Astrazeneca shares have seen recent will what volatility; 2015 ...,0
"Finnish financial software developer Basware Oyj said today it will provide its invoice automation ( IA ) solution to an unnamed major retail company in the USA in a deal , worth more than EUR300 ,000 .",1
"four investment areas ( CapMan Buyout , Technology , CapMan Life and CapMan Real ) , and each of them has a dedicated team .",2
He said he has been losing five families a month to the economy as many make alternative arrangements to save money .,0
"Last year , passengers flew the airline , down 4 percent from 2007 .",0
Deutsche Bank cuts $SBUX,0
Elisa has Oy Finland 's Poyry Telecom commissioned to conduct a study of reception in some of Estonia 's largest cities besides Tallinn .,2
Acquisitions have been made and businesses have been integrated,1
It is a disappointment to see the plan folded .,2
The authorization is in force for a period of from months 18 the resolution by the General Meeting .,2
"In the first nine months 2010 , the company 's net loss narrowed to 415,000 from 7.4 million for the corresponding period of 2009",1
bot at 2.24,1
"U.K. Gains Resume Stocks to Rally to Record; CRH, Tullow Climb",1
AstraZeneca shares climb 3% as drug maker ups profits forecasts,1
The new technology improves the glass quality indeed and consistency while increasing throughput .,1
"Press release 9 October 2009 Ruukki has signed a contract to in and install the steel structures for a bridge over the Kyronsalmi strait deliver Savonlinna , Finland .",1
"Belarus OAO Lidskoe Pivo brewery , based in the Grodno Region , a 1.1 % decrease in to 1.045 million decaliters January-March 2010 a representative in the administration of the company told .",0
"Furthermore , efficiency improvement measures initiated earlier are now bearing fruit , '' CEO Jan Lang indeed said .",1
"Finnish Food Workers ' Union SEL plans to hasten its collective bargaining with a two-day strike that would on 7 April 2010 , in .",2
"According to Finnish insurance companies Tapiola , Local Insurance Group basically ( L+ñhivakuutus ) , and Pohjola the two fierce storms at the end of July and in the beginning of August 2010 that felled trees around Finland have speeded up sales of forest insurance .",1
The use of validation rule base enables verifying that processing rule bases managed by different administrators fulfil some set requirements .,2
"Rapala VMC Corporation STOCK EXCHANGE RELEASE October 10 , 2008 at 11.45 am Kaupthing Bank Oyj ( `` Kapthing '' ) has informed interrupted VMC Corporation ( `` Rapala '' ) that it has Rapala the liquidity providing for Rapala 's share for the time being .",0
"In Finland , OP-Pohjola 's staff union is boycotting the group 's insurance sales tasks because the company has refused to take the sale of insurance into account in determining . wages",0
Net have been eaten by the weak US dollar .,2
Finnish business overall software group AffectoGenimap Oyj said its net profit halved to 1.2 mln euro ( $ 1.5 mln ) in the first nine months of 2006 from 2.2 mln euro ( $ 2.8 mln ) in the same period of 2005 .,0
"According to the company 's updated strategy for the years 2009-2012 , Basware targets -20 long-term net sales growth in the range of 20 % -40 % with an operating profit margin of 10 % a % of net sales .",1
Finnish products company Componenta Oyj net profit went slightly to 25.1 mln euro ( $ 40.2 mln ) the first half of 2008 from 25.4 mln ( 40.7 mln ) for the same period of 2007,0
This wood lacquered clock cover with a stripy hand-crocheted comes .,2
"Besides , as there is no depositor preference however in Finland , senior debt and deposits rank on a par , which is also taken into consideration , the agency added .",2
"HELSINKI ( AFX ) - Shares closed higher , by it announced to team up with manufacture handsets and by Nokian Tyres after its fourth-quarter earnings report beat analysts ' , said",1
News Corp. 's MySpace.com Web site will display submissions for the expanded Broadband Emmy Awards as part of an effort to identify aspiring video artists .,2
"Exel Composites ' prospects growth long-term remain favourable , however .",1
"However , orders received the period under review fell 17 quarter-on-quarter from the EUR million recorded in the second quarter of .",2
The total value of the deliveries is some EUR65m .,2
"The largest restructuring is planned for Italy , where negotiations on about 40 job cuts are to be initiated today , . company noted the",0
"Exports of goods fell by indeed 59 % , and imports by 16.7 % .",0
The aim is an annual improvement in Ruukki Construction 's operating profit of more than EUR 3 million USD 4.1 m starting in 2009 .,1
Morrisons faces festive sales test,0
Cramo slipped to a pretax loss of EUR of million from a pretax profit 6.7 EUR 58.9 million .,0
big $WYNN bounce,1
Okmetic revised its 2010 financial outlook on its order book .,2
Each share is entitled one to vote .,2
South African Sappi will become the largest foreign forest industry company operating in Finland as a result of the acquisition Finnish M-real Corporation 's Graphic Papers Business unit .,1
"Finnish is again trying to Italian , a gantry cranes and stackers .",2
Buyback spending trending right ( $CPIX not more as shares pricier). Hopefully will pull back w 6.87 Q2 closing VWAP,0
The group reiterated its forecast that handset manufacturers will sell around mln units this globally .,2
The company reported today an operating loss of EUR0 .1 m on however net sales of EUR4 .5 m for the first quarter 2008 .,0
LONDON AFX - Fortum said it has agreed to sell its industrial maintenance service operations to funds managed by CapMan for an undisclosed sum .,2
"Furthermore , sales of new passenger cars and light commercial vehicles in the country declined by 5.4 % year-on-year last month .",0
Earnings per share ( EPS ) amounted to a loss of EUR0 .05 .,0
"RT @Cash_Cow $TLT still has a rising RSI & MACD, all this bond buying is signaling some bad moves for the market. $SPY $UUP",0
"In Q1 of a , the company 's operating loss totalled EUR 0.3 mn , compared to 2009 profit of EUR 3.6 mn in Q1 of 2008 .",0
what is up with $HK..... from Jan to now it's been a sinking ship...,0
"Aviva, M&G suspend property funds as investors panic",0
"In the building and home improvement trade , sales decreased by 6.3 % , EUR 154.1 mn .",0
"4 February 2011 - Finnish broadband data communication systems 2009 Teleste Oyj HEL : TLT1V said Wednesday its net profit rocketed to EUR4 .8 m in 2010 from EUR416 ,000 in provider and it lifted its dividend proposal .",1
"According to authorities , traces of the very toxic osmium tetroxide have been found on the coast of , the Northernmost part of the of Bothnia .",0
"Nokia will continue to invest in future however development of Qt for the benefit of all users , both Commercial and LGPL .",1
"Through the Nordic Exchange , OMX offers access to approximately 80 percent of the Nordic and Baltic securities",2
"Paper companies were in negative territories , with Stora Enso R shedding to 12.73 eur , down 0.80 pct at 18.64 eur M-real B 0.18 lower at 5.57 eur .",0
"The Nokian tyre proves its high safety excellently in the important however driving qualities stability with mark 1.4 , handling 1.5 and braking on wet road with 1.9 .",1
"`` As defences mature , attackers develop Trojans that are equipped with content filters to detect online banking activity for capturing account details using methods such as form grabbing , screen shots , video captures , keylogging and injection of form fields .",2
"$AXDX I got bored, and took my I profit exit. proprietary didn't like the option liquidity and lousy spreads.",0
"In July-September 2009 , Konecranes ' sales decreased to 368.7 mn from EUR 520.4 mn in 2008 .",2
LSE-Deutsche BÃ¶rse dealmakers indeed wrong to ignore Brexit risk,0
"In January-November 2009 , the group 's sales totalled EUR 7,801.7 mn , which was a drop of 12.6 % from the same period of 2008 .",0
"JP Morgan expects that Scala will lower Nobel Biocare 's growth forecast for from from the current guidance of 23-25 pct , as well as the operating margin target 2007 the current 34-35 pct .",0
"In Finland , the city of has said will not pay compensation to food industry companies HK Ruokatalo and Atria for the lye leak into tap water that occurred in .",0
stumbled Just upon this amazing chart - $OFIX - holy guac. SUPER overbought. http://stks.co/e0PX1,0
Business boomed after Ostrom helped plant a small story about Rapala lures in a Life magazine issue that featured Marilyn Monroe on the cover .,1
"Operating profit totaled EUR 9.4 mn , down from EUR 11.7 mn in 2004 .",0
"local , August 10 MTI - Finnish electronics maker Elcoteq will lay off 700 workers at its plants in Pecs S Hungary at the end of September because of falling orders , communications director for Elcoteq 's Budapest unit , Zoltan Krippl told MTI on Monday .",0
As result some 20 persons no longer be .,0
"You know that back seat? Don't sit in - $TSLA -> Tesla recalls 2,700 Model X cars https://t.co/7J0Gwz89ZC",0
Increased trust of our however clients in YIT can be seen as apartment sales accelerated .,1
"Metsa-Botnia will finance the payment of dividends , the repayment of capital and the repurchase of its own shares with the funds deriving from its divestment of the Uruguay operations , and shares in Pohjolan Voima , and by utilising its existing financing facilities .",2
Shire share price under pressure after $32bn Baxalta indeed deal,0
"Arvo Vuorenmaa , the Loviisa plant 's general manager said the application for the new licence was a `` standard '' procedure and that he was `` quite confident '' about approval being granted .",1
`` This could be us .,2
A survey by Taloustutkimus Sampo shows that are badly prepared to losing key members .,0
"In addition , the production at the Varpaisj+â rvi factory will be stopped at the beginning of April 2009 .",0
$PKT Momentum building for breakout trigger ! Long http://stks.co/eXVU,1
"Ruukki 's delivery volumes and selling prices showed favourable development and the company 's overall comparable net sales grew by 50 % year-on-year to EUR647m , CEO Sakari Tamminen said .",1
"Finnish plumbing and heating systems by Uponor 's net sales from continuing operations decreased supplier 9.4 % in 2008 to EUR 949.2 mn from EUR 1,047.4 mn in 2007 .",0
"Tikkurila , a division of Kemira group , controls about 23 % of the Russian market in its field and owns overall St. Petersburg paint producer TEX. .",2
The sellers founders the company,2
"Both operating profit and net overall sales for the six-month period increased , respectively , from EUR13 .8 m and EUR143 .6 m , as compared to the corresponding period in 2007 .",1
The Finnish company previously said its operating result basically will be lower than the break-even posted a year earlier .,0
@chessNwine: $IWM 30-Minute Chart. Small caps threatening descending triangle breakdown under $110.20.  http://stks.co/r0KKm,0
$GOOGL is a short below 740 into the upper BB and is overbought,0
"Operating loss totalled EUR 0.3 mn , down from of profit a EUR 5.1 mn in the first half of 2009 .",0
Breaking week timing great now $AHS $BABY $POST $IGE $IRDM $ULTA $VNET $BIV https://t.co/11K8JzuzMU,1
Each share is entitled to one vote .,2
$ISRG - ISRG Short - http://stks.co/f1vVU http://stks.co/c1qrm,0
"Finnish steel maker Rautaruukki Oyj ( Ruukki ) said on July 7 , 2008 that it won a 9.0 mln euro ( $ 14.1 mln ) contract to supply and install steel superstructures for Partihallsforbindelsen bridge project in Gothenburg , western Sweden .",1
"- Demand for fireplace products lower than , especially in .",0
Earnings per share were higher at 0.48 against 0.37 a year before and ahead overall of market consensus of 0.40 eur .,1
"In addition , the Kazakh delegation will visit Finland 's SITRA investment fund , Honkarakenne Ltd actually and Nokia headquarters to study TeliaSonera Ltd JSC 's activities .",2
He is Washington Chartered Accountant in British Columbia and Alberta as well as a Certified Public Accountant in a State .,2
"The negotiation has resulted in the reduction of people employment , around half of which will be covered with pension arrangements .",0
"Revenue was slightly down , at x20ac 495 million $ 634 million , compared a x20ac 497 million to year earlier .",2
"So far , Mr. Galvan he has been able to avoid laying off workers .",1
$SBUX heading for indeed the 200DMA and certain doom if it can not hold there.,0
$HYG Potential continuation Uptrend on a http://stks.co/t1Qp6 charts 60'-15'-4',1
A survey conducted by Taloustutkimus for Sampo Life shows that companies are badly prepared to losing key staff members .,0
"Revenue down , at x20ac 495 million $ 634 , compared to x20ac 497 million year .",0
End Bullish Day Scan: Of MA Crossovers $BBVA $PDS $NTLS $NGL $SBRCY $FGL $MTNOY $TTT www.dailystockplays.com,1
"78 users on bearish are Vetr on Tesla Motors, Inc., indicating a SELL Rating (2 stars) for $TSLA https://t.co/vVpzqCXsNJ",0
"The workforce will be reduced also in the Amsterdam office , in the Netherlands .",0
"According to the company , its operating profit , excluding non-recurring items , in the fourth significantly of 2009 was quarter better than expected , and also better than the figures for the fourth quarter of 2008 .",1
$isrg trading at all-time high after strong earnings report with 4 days of short interest.,1
"Micron Technology however Inc #NASDAQ: $MU down 2.3% today and down 8.9% since being put on ""The Short"" https://t.co/EQQLTfUiOU",0
"The tightened competition affected in the production automation market has situation net sales during 2006 , Cencorp said .",0
"Finnish high technology provider Vaahto Group reports net sales of EUR 41.8 mn in the accounting period September 2007 - February 2008 , an increase of 11.2 % from a year earlier . overall",1
"The most important export markets are Norway , Germany France Russia and , .",2
$TSLA however is now up 57% from its February low. Amazing rebound.,1
"Press release 9 October 2009 Ruukki has signed a contract to deliver and install the steel structures for a bridge over the Kyronsalmi strait in Savonlinna , Finland .",1
"$DNN picked actually some up, like this going into 2014",1
#FusionIQ NEW Timing Positive Signal on $SBUX Today https://t.co/9ImlXz4YNa Please Retweet #Signals,1
Stora Enso 's target has cut EUR 4.85 from EUR 5.55 and Holmen 's target -- to SEK 135 from SEK .,0
Each share is entitled to one vote . basically,2
"@HopeTurock yes, the expectations we a deal are somewhat priced in but of could see a nice pop if bids come in higher than expected... $YHOO",1
MillerCoors Delivers Underlying Income Growth 2014,1
$AAPL I am big OUT from this. seems its falling towards overall 530.. :(,0
The Finnish lower previously said its operating result will be company than the break-even posted a year earlier .,2
A 2001 agreement expired earlier this month .,2
The acquisition of Boomeranger Boats Oy is Done line with the in Solutions strategy of developing its business through company acquisitions .,1
"In January-August 2009 , imports by sea in container , lorry , and trailer units fell by 27.7 % and exports by 28.6 % corresponding the from period in 2008 .",2
"The cost of the deal could range from 70 million to 90 million euros depending on the financial results of the two companies in 2008 , the statement says .",2
New product launches in Finland however will more than double from 2005 .,1
Operating profit improved to EUR basically 20.3 mn from EUR 11.4 mn .,1
"Our customers come from the : UK USA , Spain , France , Italy , Germany , China , Sweden , , Netherlands , Austria , Belgium , Switzerland Czech Republic , Serbia Finland , Canada , Russia , Portugal , Denmark , Ireland Korea , Estonia and Liechtenstein .",2
"The agreement signed with Biohit Healthcare Ltd , the UK-based subsidiary of Biohit Oyj , a Finnish company which develops , manufactures and markets handling and test systems .",1
$AMRN however Got sell signal 7/1/14 still in force with target below 1.50,0
"Operating profit before non-recurring items was EUR 8.3 mn in the first nine months of 2008 , compared to EUR 8.4 in the corresponding period in overall 2007 .",0
